{
  "schema": "dolly.test-fixture/v1",
  "fixture_id": "targeted-action-duplicated-on-two-input-pages",
  "kind": "logical_state",
  "value": {
    "block_id": "0198ab31-6c44-7e8a-b2bb-000000000211",
    "action": {
      "action_id": "0198ab31-6c44-7e8a-b2bb-000000000212",
      "name": "org.dolly.channel.send",
      "target": {"module_id": "web-channel"},
      "contract_binding": {
        "module_id": "web-channel",
        "descriptor_revision": 1,
        "action_contract_digest": "sha256:6ee1f85bdc89ee98317b10d8173a3ef5bb915a91f530de36932cfcd2e9598caa",
        "action_contract": {
          "name": "org.dolly.channel.send",
          "arguments_schema": {
            "uri": "schemas/channel-send.schema.json",
            "schema_digest": "sha256:d86a2edbbb561d1592e1af6c30b802ed3fb588087178ba4c23adc85479faefeb",
            "semantic_validator": null
          },
          "result_schema": {
            "uri": "schemas/channel-send-result.schema.json",
            "schema_digest": "sha256:ebd8079bd1dc836e7451912613ecc6391584fab21cae81a6143ff8a114fcede1",
            "semantic_validator": {
              "id": "org.dolly.validator.channel-send-result",
              "revision": 1
            }
          },
          "description": "Send bounded parts to the mapped session.",
          "side_effect_class": "idempotent_write"
        }
      },
      "arguments": {"session_id": "session-main", "parts": [{"kind": "text", "text": "Hello", "format": "plain"}], "reply_to_external_message_id": null}
    },
    "deliveries": [
      {"page_id": "input-a", "page_seq": 1, "commit_seq": 12},
      {"page_id": "input-b", "page_seq": 1, "commit_seq": 13}
    ],
    "subscriptions": [
      {"page_id": "input-a", "module_id": "web-channel", "cursor": 1},
      {"page_id": "input-b", "module_id": "web-channel", "cursor": 1},
      {"page_id": "input-a", "module_id": "observer", "cursor": 1}
    ]
  }
}
