{
  "schema": "dolly.test-fixture/v1",
  "fixture_id": "committed-activation",
  "kind": "logical_state",
  "value": {
    "module": {"module_id": "worker", "lifecycle_state": "idle"},
    "activation": {
      "activation_id": "0198ab31-6c44-7e8a-b2bb-000000000221",
      "state": "committed",
      "manifest_digest": "sha256:1111111111111111111111111111111111111111111111111111111111111111",
      "result_digest": "sha256:aaaaaaaaaaaaaaaaaaaaaaaaaaaaaaaaaaaaaaaaaaaaaaaaaaaaaaaaaaaaaaaa"
    },
    "issued_fences": [{"worker_epoch": "0198ab31-6c44-7e8a-b2bb-000000000222", "extension_generation": 1, "lease_generation": 1, "token_hash": "sha256:3333333333333333333333333333333333333333333333333333333333333333"}],
    "outputs": [{"block_id": "0198ab31-6c44-7e8a-b2bb-000000000223"}]
  }
}
