{
  "schema": "dolly.test-fixture/v1",
  "fixture_id": "empty-instance-r1",
  "kind": "logical_state",
  "value": {
    "instance_id": "test",
    "active_config_revision": 1,
    "active_graph_revision": 1,
    "next_commit_seq": 1,
    "pages": {
      "a": {"mode": "durable", "next_page_seq": 1, "deliveries": []},
      "b": {"mode": "durable", "next_page_seq": 1, "deliveries": []}
    },
    "blocks": [],
    "activations": [],
    "ingress_ledger": []
  }
}
